annotation_id,annotator,email,created_at,timestamp,id,image,lead_time,text_cap_en,text_cap_native,text_culture_loc,text_image_loc,text_submitter_native_lang,updated_at
,,seacrowd.research@gmail.com,06/02/2025 00:00:00,06/02/2025 00:00:00,bulk_2586,https://raw.githubusercontent.com/SEACrowd/sea-vl-image-collection/refs/heads/main/data/IMG_0366%20-%20B%C3%B6rje%20Karlsson.jpg,,"Ganesh status, in one of the temples in the capital.","Estátua de Ganesh, em um dos templos na capital.",Cambodia,"Phnom Penh, Cambodia",Portuguese (por),
,,seacrowd.research@gmail.com,06/02/2025 00:00:00,06/02/2025 00:00:00,bulk_2587,https://raw.githubusercontent.com/SEACrowd/sea-vl-image-collection/refs/heads/main/data/IMG_0385%20-%20B%C3%B6rje%20Karlsson.jpg,,Tomle Sap river. The only bay that changes direction every 6 months.,Rio Tonle Sap. A única baía que muda de direção a cada 6 meses.,Cambodia,"Phnom Penh, Cambodia",Portuguese (por),
,,seacrowd.research@gmail.com,06/02/2025 00:00:00,06/02/2025 00:00:00,bulk_2588,https://raw.githubusercontent.com/SEACrowd/sea-vl-image-collection/refs/heads/main/data/IMG_8430%20-%20B%C3%B6rje%20Karlsson.jpg,,"The main entrance to Angkor Wat (""Temple City"").","Entrada principal de Angkor Wat (""Cidade dos Templos"").",Cambodia,"Siem Reap, Cambodia",Portuguese (por),
,,seacrowd.research@gmail.com,06/02/2025 00:00:00,06/02/2025 00:00:00,bulk_2589,https://raw.githubusercontent.com/SEACrowd/sea-vl-image-collection/refs/heads/main/data/IMG_8439%20-%20B%C3%B6rje%20Karlsson.jpg,,"Outer wall of Angkor Wat, viewed from the inside.","Muralha externa de Angkor Wat, vista de dentro.",Cambodia,"Siem Reap, Cambodia",Portuguese (por),
,,seacrowd.research@gmail.com,06/02/2025 00:00:00,06/02/2025 00:00:00,bulk_2590,https://raw.githubusercontent.com/SEACrowd/sea-vl-image-collection/refs/heads/main/data/IMG_8440%20-%20B%C3%B6rje%20Karlsson.jpg,,One of the old library buildings in Angkor Wat.,Uma das antigas bibliotecas de Angkor Wat.,Cambodia,"Siem Reap, Cambodia",Portuguese (por),
,,seacrowd.research@gmail.com,06/02/2025 00:00:00,06/02/2025 00:00:00,bulk_2591,https://raw.githubusercontent.com/SEACrowd/sea-vl-image-collection/refs/heads/main/data/IMG_8444%20-%20B%C3%B6rje%20Karlsson.jpg,,One of the four roads that reach Angkor Wat.,Uma das quatro estradas que chegam em Angkor Wat.,Cambodia,"Siem Reap, Cambodia",Portuguese (por),
,,seacrowd.research@gmail.com,06/02/2025 00:00:00,06/02/2025 00:00:00,bulk_2592,https://raw.githubusercontent.com/SEACrowd/sea-vl-image-collection/refs/heads/main/data/IMG_8453%20-%20B%C3%B6rje%20Karlsson.jpg,,Corner tower of the inner wall in Angkor Wat.,Esquina da muralha interna de Angkor Wat.,Cambodia,"Siem Reap, Cambodia",Portuguese (por),
,,seacrowd.research@gmail.com,06/02/2025 00:00:00,06/02/2025 00:00:00,bulk_2593,https://raw.githubusercontent.com/SEACrowd/sea-vl-image-collection/refs/heads/main/data/IMG_8459%20-%20B%C3%B6rje%20Karlsson.jpg,,Inner view of Angor Wat and three of its signature inner towers.,Vista interna de Angkor Wat e três de suas famosas torres.,Cambodia,"Siem Reap, Cambodia",Portuguese (por),
,,seacrowd.research@gmail.com,06/02/2025 00:00:00,06/02/2025 00:00:00,bulk_2594,https://raw.githubusercontent.com/SEACrowd/sea-vl-image-collection/refs/heads/main/data/IMG_8464%20-%20B%C3%B6rje%20Karlsson.jpg,,"Angkor Wat, viewed from the opposite side of its main entrance.",Angkor Wat visto por trás.,Cambodia,"Siem Reap, Cambodia",Portuguese (por),
,,seacrowd.research@gmail.com,06/02/2025 00:00:00,06/02/2025 00:00:00,bulk_2595,https://raw.githubusercontent.com/SEACrowd/sea-vl-image-collection/refs/heads/main/data/IMG_8476%20-%20B%C3%B6rje%20Karlsson.jpg,,View of the moat that surrounds Angkor Wat.,Vista do fosso que circunda Angkor Wat.,Cambodia,"Siem Reap, Cambodia",Portuguese (por),
,,seacrowd.research@gmail.com,06/02/2025 00:00:00,06/02/2025 00:00:00,bulk_2596,https://raw.githubusercontent.com/SEACrowd/sea-vl-image-collection/refs/heads/main/data/IMG_8487%20-%20B%C3%B6rje%20Karlsson.jpg,,Details of the engravings in the walls around Angkor Wat.,Detalhes dos entalhes nas pareder ao redor de Angkor Wat.,Cambodia,"Siem Reap, Cambodia",Portuguese (por),
,,seacrowd.research@gmail.com,06/02/2025 00:00:00,06/02/2025 00:00:00,bulk_2597,https://raw.githubusercontent.com/SEACrowd/sea-vl-image-collection/refs/heads/main/data/IMG_8503%20-%20B%C3%B6rje%20Karlsson.jpg,,Low relief carvings in the walls surrounding the inner Angkor Wat.,Entalhes em baixo relevo nas paredes que circundam Angkor Wat.,Cambodia,"Siem Reap, Cambodia",Portuguese (por),
,,seacrowd.research@gmail.com,06/02/2025 00:00:00,06/02/2025 00:00:00,bulk_2598,https://raw.githubusercontent.com/SEACrowd/sea-vl-image-collection/refs/heads/main/data/IMG_8545%20-%20B%C3%B6rje%20Karlsson.jpg,,"One of the few buddha statues remaining whole. Million Buddhas Pavillion, Angkor Wat. Most statues were taken away by the French ""colonizers"" or destroyed by the Khmer Rouge in the 70s.","Um dos poucos budas que ainda estão inteiros. Pavilhão dos mil Budas, salão oeste de Angkor Wat. A maioria das outras estátuas que ainda existiam foram levadas pelos ""colonisadores"" franceses ou destruídas/decapitadas pelo Khmer Rouge por volta dos anos 70.",Cambodia,"Siem Reap, Cambodia",Portuguese (por),
,,seacrowd.research@gmail.com,06/02/2025 00:00:00,06/02/2025 00:00:00,bulk_2599,https://raw.githubusercontent.com/SEACrowd/sea-vl-image-collection/refs/heads/main/data/IMG_8591%20-%20B%C3%B6rje%20Karlsson.jpg,,"South gate and bridge, Angkor Thom.","Portão e ponte sul, Angkor Thom.",Cambodia,"Siem Reap, Cambodia",Portuguese (por),
,,seacrowd.research@gmail.com,06/02/2025 00:00:00,06/02/2025 00:00:00,bulk_2600,https://raw.githubusercontent.com/SEACrowd/sea-vl-image-collection/refs/heads/main/data/IMG_8595%20-%20B%C3%B6rje%20Karlsson.jpg,,Gods restraining a giant Naga.,Deuses segurando uma Naga gigante.,Cambodia,"Siem Reap, Cambodia",Portuguese (por),
,,seacrowd.research@gmail.com,06/02/2025 00:00:00,06/02/2025 00:00:00,bulk_2601,https://raw.githubusercontent.com/SEACrowd/sea-vl-image-collection/refs/heads/main/data/IMG_8601%20-%20B%C3%B6rje%20Karlsson.jpg,,"Sculpted faces, present in all gates.","Faces esculpídas, presentes em todos os portões.",Cambodia,"Siem Reap, Cambodia",Portuguese (por),
,,seacrowd.research@gmail.com,06/02/2025 00:00:00,06/02/2025 00:00:00,bulk_2602,https://raw.githubusercontent.com/SEACrowd/sea-vl-image-collection/refs/heads/main/data/IMG_8609%20-%20B%C3%B6rje%20Karlsson.jpg,,"Bayon, in the middle of Angkor Thom.","Bayon, no centro de Angor Thom.",Cambodia,"Siem Reap, Cambodia",Portuguese (por),
,,seacrowd.research@gmail.com,06/02/2025 00:00:00,06/02/2025 00:00:00,bulk_2603,https://raw.githubusercontent.com/SEACrowd/sea-vl-image-collection/refs/heads/main/data/IMG_8629%20-%20B%C3%B6rje%20Karlsson.jpg,,Outside mural in the Bayon.,Mural externo no Bayon.,Cambodia,"Siem Reap, Cambodia",Portuguese (por),
,,seacrowd.research@gmail.com,06/02/2025 00:00:00,06/02/2025 00:00:00,bulk_2604,https://raw.githubusercontent.com/SEACrowd/sea-vl-image-collection/refs/heads/main/data/IMG_8647%20-%20B%C3%B6rje%20Karlsson.jpg,,The Bayon's most distinctive feature is the multitude of serene and smiling stone faces of Brahma.,A característica mais distintiva do Bayon é a multidão de rostos de pedra serenos e sorridentes de Brahma.,Cambodia,"Siem Reap, Cambodia",Portuguese (por),
,,seacrowd.research@gmail.com,06/02/2025 00:00:00,06/02/2025 00:00:00,bulk_2605,https://raw.githubusercontent.com/SEACrowd/sea-vl-image-collection/refs/heads/main/data/IMG_8679%20-%20B%C3%B6rje%20Karlsson.jpg,,"Baphuon, another mega temple in Angkor Thom, north of Bayon.","Baphuon, outro mega templo em Angkor Thom, ao norte do Bayon.",Cambodia,"Siem Reap, Cambodia",Portuguese (por),
,,seacrowd.research@gmail.com,06/02/2025 00:00:00,06/02/2025 00:00:00,bulk_2606,https://raw.githubusercontent.com/SEACrowd/sea-vl-image-collection/refs/heads/main/data/IMG_8695%20-%20B%C3%B6rje%20Karlsson.jpg,,Heads in the Victory Gate. On the path to Ta Prohm.,Cabeças do Portão da Vitória. Caminho pra Ta Prohm.,Cambodia,"Siem Reap, Cambodia",Portuguese (por),
,,seacrowd.research@gmail.com,06/02/2025 00:00:00,06/02/2025 00:00:00,bulk_2607,https://raw.githubusercontent.com/SEACrowd/sea-vl-image-collection/refs/heads/main/data/IMG_8704%20-%20B%C3%B6rje%20Karlsson.jpg,,"Thommanon. A ""small"" temple to the left once one exits the Victory Gate and cross the bridge.","Thommanon. Templo ""pequeno"" à esquerda depois que se sai pelo Portão da Vitória de Angkor Thom e atravessa a ponte.",Cambodia,"Siem Reap, Cambodia",Portuguese (por),
,,seacrowd.research@gmail.com,06/02/2025 00:00:00,06/02/2025 00:00:00,bulk_2608,https://raw.githubusercontent.com/SEACrowd/sea-vl-image-collection/refs/heads/main/data/IMG_8720%20-%20B%C3%B6rje%20Karlsson.jpg,,"Impressive details in the engravings. Faces, hands...","Detalhes impressionantes dos entralhes. Rostos, mãos...",Cambodia,"Siem Reap, Cambodia",Portuguese (por),
,,seacrowd.research@gmail.com,06/02/2025 00:00:00,06/02/2025 00:00:00,bulk_2609,https://raw.githubusercontent.com/SEACrowd/sea-vl-image-collection/refs/heads/main/data/IMG_8724%20-%20B%C3%B6rje%20Karlsson.jpg,,Chau Say Tevoda. Most of the tourists don't visit it.,Templo Chau Say Tevoda. A maioria dos turista não o visita.,Cambodia,"Siem Reap, Cambodia",Portuguese (por),
,,seacrowd.research@gmail.com,06/02/2025 00:00:00,06/02/2025 00:00:00,bulk_2610,https://raw.githubusercontent.com/SEACrowd/sea-vl-image-collection/refs/heads/main/data/IMG_8731%20-%20B%C3%B6rje%20Karlsson.jpg,,"Ta Keo. Gigantic structure, but it was never finished.","Ta Keo. Estrutura gigante, mas nunca foi terminado.",Cambodia,"Siem Reap, Cambodia",Portuguese (por),
,,seacrowd.research@gmail.com,06/02/2025 00:00:00,06/02/2025 00:00:00,bulk_2611,https://raw.githubusercontent.com/SEACrowd/sea-vl-image-collection/refs/heads/main/data/IMG_8746%20-%20B%C3%B6rje%20Karlsson.jpg,,Entrance to Ta Prohm.,Entrada de Ta Prohm.,Cambodia,"Siem Reap, Cambodia",Portuguese (por),
,,seacrowd.research@gmail.com,06/02/2025 00:00:00,06/02/2025 00:00:00,bulk_2612,https://raw.githubusercontent.com/SEACrowd/sea-vl-image-collection/refs/heads/main/data/IMG_8752%20-%20B%C3%B6rje%20Karlsson.jpg,,Ta Prohm.,Ta Prohm.,Cambodia,"Siem Reap, Cambodia",Portuguese (por),
,,seacrowd.research@gmail.com,06/02/2025 00:00:00,06/02/2025 00:00:00,bulk_2613,https://raw.githubusercontent.com/SEACrowd/sea-vl-image-collection/refs/heads/main/data/IMG_8798%20-%20B%C3%B6rje%20Karlsson.jpg,,Prasat Kravan.,Prasat Kravan.,Cambodia,"Siem Reap, Cambodia",Portuguese (por),
,,seacrowd.research@gmail.com,06/02/2025 00:00:00,06/02/2025 00:00:00,bulk_2614,https://raw.githubusercontent.com/SEACrowd/sea-vl-image-collection/refs/heads/main/data/IMG_8813%20-%20B%C3%B6rje%20Karlsson.jpg,,Vishnu in the form of Vamana. Vamana is the youngest brother of Indra.,Vishnu na forma de Vamana. Vamana é o irmão mais novo de Indra.,Cambodia,"Siem Reap, Cambodia",Portuguese (por),
,,seacrowd.research@gmail.com,06/02/2025 00:00:00,06/02/2025 00:00:00,bulk_2615,https://raw.githubusercontent.com/SEACrowd/sea-vl-image-collection/refs/heads/main/data/IMG_8855%20-%20B%C3%B6rje%20Karlsson.jpg,,Bantheay Kdei.,Bantheay Kdei.,Cambodia,"Siem Reap, Cambodia",Portuguese (por),
,,seacrowd.research@gmail.com,06/02/2025 00:00:00,06/02/2025 00:00:00,bulk_2616,https://raw.githubusercontent.com/SEACrowd/sea-vl-image-collection/refs/heads/main/data/IMG_8866%20-%20B%C3%B6rje%20Karlsson.jpg,,Sunrise at Sra Srang.,Nascer do sol em Sra Srang.,Cambodia,"Siem Reap, Cambodia",Portuguese (por),
,,seacrowd.research@gmail.com,06/02/2025 00:00:00,06/02/2025 00:00:00,bulk_2617,https://raw.githubusercontent.com/SEACrowd/sea-vl-image-collection/refs/heads/main/data/IMG_8870%20-%20B%C3%B6rje%20Karlsson.jpg,,Pre Rup.,Pre Rup.,Cambodia,"Siem Reap, Cambodia",Portuguese (por),
,,seacrowd.research@gmail.com,06/02/2025 00:00:00,06/02/2025 00:00:00,bulk_2618,https://raw.githubusercontent.com/SEACrowd/sea-vl-image-collection/refs/heads/main/data/IMG_8875%20-%20B%C3%B6rje%20Karlsson.jpg,,Pre Rup. Inner view.,Pre Rup. Vista interna.,Cambodia,"Siem Reap, Cambodia",Portuguese (por),
,,seacrowd.research@gmail.com,06/02/2025 00:00:00,06/02/2025 00:00:00,bulk_2619,https://raw.githubusercontent.com/SEACrowd/sea-vl-image-collection/refs/heads/main/data/IMG_8905%20-%20B%C3%B6rje%20Karlsson.jpg,,Elephant sculpture. Pre Rup.,Estátus de elefante. Pre Rup.,Cambodia,"Siem Reap, Cambodia",Portuguese (por),
,,seacrowd.research@gmail.com,06/02/2025 00:00:00,06/02/2025 00:00:00,bulk_2620,https://raw.githubusercontent.com/SEACrowd/sea-vl-image-collection/refs/heads/main/data/IMG_8909%20-%20B%C3%B6rje%20Karlsson.jpg,,"Banteay Srei. The most detailed temple of all. The material used is Pink Sandstone, which highlights the drawings, especially in the morning light. In the detail, Siva sits on a kala.","Banteay Srei. O templo mais detalhados de todos. O material usado é Pink Sandstone, o que resalta os desenhos, especialmente na luz de manhã. No detalhe o desenho mostra Siva sentado em uma kala.",Cambodia,"Siem Reap, Cambodia",Portuguese (por),
,,seacrowd.research@gmail.com,06/02/2025 00:00:00,06/02/2025 00:00:00,bulk_2621,https://raw.githubusercontent.com/SEACrowd/sea-vl-image-collection/refs/heads/main/data/IMG_8936%20-%20B%C3%B6rje%20Karlsson.jpg,,Banteay Srei. Inner view.,Banteay Srei. Vista interna.,Cambodia,"Siem Reap, Cambodia",Portuguese (por),
,,seacrowd.research@gmail.com,06/02/2025 00:00:00,06/02/2025 00:00:00,bulk_2622,https://raw.githubusercontent.com/SEACrowd/sea-vl-image-collection/refs/heads/main/data/IMG_8943%20-%20B%C3%B6rje%20Karlsson.jpg,,Shiva sitting on a kala (a mythical creature that represents time).,Shiva sentado em uma kala (criatura mitológica que representa o tempo).,Cambodia,"Siem Reap, Cambodia",Portuguese (por),
,,seacrowd.research@gmail.com,06/02/2025 00:00:00,06/02/2025 00:00:00,bulk_2623,https://raw.githubusercontent.com/SEACrowd/sea-vl-image-collection/refs/heads/main/data/IMG_8949%20-%20B%C3%B6rje%20Karlsson.jpg,,"The demon Ravana shakes Mount Kailasa, Siva's residence.","O demônio Ravana sacudindo o Monte Kailasa, residência de Siva.",Cambodia,"Siem Reap, Cambodia",Portuguese (por),
,,seacrowd.research@gmail.com,06/02/2025 00:00:00,06/02/2025 00:00:00,bulk_2624,https://raw.githubusercontent.com/SEACrowd/sea-vl-image-collection/refs/heads/main/data/IMG_8966%20-%20B%C3%B6rje%20Karlsson.jpg,,Corner stone engraved in the form of a Naga.,Canto entalhado na forma de uma Naga.,Cambodia,"Siem Reap, Cambodia",Portuguese (por),
,,seacrowd.research@gmail.com,06/02/2025 00:00:00,06/02/2025 00:00:00,bulk_2625,https://raw.githubusercontent.com/SEACrowd/sea-vl-image-collection/refs/heads/main/data/IMG_9074%20-%20B%C3%B6rje%20Karlsson.jpg,,Third gopuram east of Ta Som. It is the most famous because of the tree.,Terceiro gopurã leste de Ta Som. É o mais famoso por causa da árvore.,Cambodia,"Siem Reap, Cambodia",Portuguese (por),
,,seacrowd.research@gmail.com,06/02/2025 00:00:00,06/02/2025 00:00:00,bulk_2626,https://raw.githubusercontent.com/SEACrowd/sea-vl-image-collection/refs/heads/main/data/IMG_9089%20-%20B%C3%B6rje%20Karlsson.jpg,,Neak Pean.,Neak Pean.,Cambodia,"Siem Reap, Cambodia",Portuguese (por),
,,seacrowd.research@gmail.com,06/02/2025 00:00:00,06/02/2025 00:00:00,bulk_2627,https://raw.githubusercontent.com/SEACrowd/sea-vl-image-collection/refs/heads/main/data/IMG_9138%20-%20B%C3%B6rje%20Karlsson.jpg,,"West gate of Angkor Thom, the least accessible one.","Portão oeste de Angkor Thom, o menos acessível.",Cambodia,"Siem Reap, Cambodia",Portuguese (por),
,,seacrowd.research@gmail.com,06/02/2025 00:00:00,06/02/2025 00:00:00,bulk_2628,https://raw.githubusercontent.com/SEACrowd/sea-vl-image-collection/refs/heads/main/data/IMG_9160%20-%20B%C3%B6rje%20Karlsson.jpg,,Phimeanakas. Temple inside the walls of the palace.,Phimeanakas. Templo dentro das muralhas do palácio. Meio em frente à área onde era o palácio.,Cambodia,"Siem Reap, Cambodia",Portuguese (por),
,,seacrowd.research@gmail.com,06/02/2025 00:00:00,06/02/2025 00:00:00,bulk_2629,https://raw.githubusercontent.com/SEACrowd/sea-vl-image-collection/refs/heads/main/data/IMG_9174%20-%20B%C3%B6rje%20Karlsson.jpg,,Elephant Terrace. It covers the whole front of the boulevard in the eastern face of the royal palace wall.,"Terraço dos elefantes. Cobre toda a frente do ""boulevard"" na face leste da murada do palácio real. No meio do terraço fica a entrada principal da murada.",Cambodia,"Siem Reap, Cambodia",Portuguese (por),
,,seacrowd.research@gmail.com,06/02/2025 00:00:00,06/02/2025 00:00:00,bulk_2630,https://raw.githubusercontent.com/SEACrowd/sea-vl-image-collection/refs/heads/main/data/IMG_9197%20-%20B%C3%B6rje%20Karlsson.jpg,,View from the Elephant Terrace.,Vista a partir do terraço dos elefantes.,Cambodia,"Siem Reap, Cambodia",Portuguese (por),
,,seacrowd.research@gmail.com,06/02/2025 00:00:00,06/02/2025 00:00:00,bulk_2631,https://raw.githubusercontent.com/SEACrowd/sea-vl-image-collection/refs/heads/main/data/IMG_9244%20-%20B%C3%B6rje%20Karlsson.jpg,,Path throughout the temples.,Caminhos por dentro dos templos.,Cambodia,"Siem Reap, Cambodia",Portuguese (por),
,,seacrowd.research@gmail.com,06/02/2025 00:00:00,06/02/2025 00:00:00,bulk_2632,https://raw.githubusercontent.com/SEACrowd/sea-vl-image-collection/refs/heads/main/data/IMG_9245%20-%20B%C3%B6rje%20Karlsson.jpg,,Trees growing in the ruins.,Árvores crescendo nas ruínas.,Cambodia,"Siem Reap, Cambodia",Portuguese (por),
,,seacrowd.research@gmail.com,06/02/2025 00:00:00,06/02/2025 00:00:00,bulk_2633,https://raw.githubusercontent.com/SEACrowd/sea-vl-image-collection/refs/heads/main/data/IMG_9256%20-%20B%C3%B6rje%20Karlsson.jpg,,View of the city of Siem Reap.,Vista da cidade de Siem Reap.,Cambodia,"Siem Reap, Cambodia",Portuguese (por),
,,seacrowd.research@gmail.com,06/02/2025 00:00:00,06/02/2025 00:00:00,bulk_2634,https://raw.githubusercontent.com/SEACrowd/sea-vl-image-collection/refs/heads/main/data/IMG_9260%20-%20B%C3%B6rje%20Karlsson.jpg,,Kids play in the Tonle Sap river.,Crianças brincando no rio Tonle Sap.,Cambodia,"Siem Reap, Cambodia",Portuguese (por),
,,seacrowd.research@gmail.com,06/02/2025 00:00:00,06/02/2025 00:00:00,bulk_2635,https://raw.githubusercontent.com/SEACrowd/sea-vl-image-collection/refs/heads/main/data/IMG_9265%20-%20B%C3%B6rje%20Karlsson.jpg,,Preah Promreath Pagoda.,Pagoda de Preah Promreath.,Cambodia,"Siem Reap, Cambodia",Portuguese (por),
,,seacrowd.research@gmail.com,06/02/2025 00:00:00,06/02/2025 00:00:00,bulk_2636,https://raw.githubusercontent.com/SEACrowd/sea-vl-image-collection/refs/heads/main/data/IMG_9272%20-%20B%C3%B6rje%20Karlsson.jpg,,Small home shrines.,"Pequenos altares ""domésticos"".",Cambodia,"Siem Reap, Cambodia",Portuguese (por),
,,seacrowd.research@gmail.com,06/02/2025 00:00:00,06/02/2025 00:00:00,bulk_2637,https://raw.githubusercontent.com/SEACrowd/sea-vl-image-collection/refs/heads/main/data/IMG_9274%20-%20B%C3%B6rje%20Karlsson.jpg,,Preah Promreath Pagoda.,Pagoda Preah Promreath.,Cambodia,"Siem Reap, Cambodia",Portuguese (por),
,,seacrowd.research@gmail.com,06/02/2025 00:00:00,06/02/2025 00:00:00,bulk_2638,https://raw.githubusercontent.com/SEACrowd/sea-vl-image-collection/refs/heads/main/data/IMG_9278%20-%20B%C3%B6rje%20Karlsson.jpg,,Colonial architecture in Siem Reap.,Arquitetura colonial em Siem Reap.,Cambodia,"Siem Reap, Cambodia",Portuguese (por),
,,seacrowd.research@gmail.com,06/02/2025 00:00:00,06/02/2025 00:00:00,bulk_2639,https://raw.githubusercontent.com/SEACrowd/sea-vl-image-collection/refs/heads/main/data/IMG_9279%20-%20B%C3%B6rje%20Karlsson.jpg,,Siem Reap's old market.,Velho mercado de Siem Reap.,Cambodia,"Siem Reap, Cambodia",Portuguese (por),
,,seacrowd.research@gmail.com,06/02/2025 00:00:00,06/02/2025 00:00:00,bulk_2640,https://raw.githubusercontent.com/SEACrowd/sea-vl-image-collection/refs/heads/main/data/IMG_9280%20-%20B%C3%B6rje%20Karlsson.jpg,,Siem Reap's old market.,Velho mercado de Siem Reap.,Cambodia,"Siem Reap, Cambodia",Portuguese (por),
,,seacrowd.research@gmail.com,06/02/2025 00:00:00,06/02/2025 00:00:00,bulk_2641,https://raw.githubusercontent.com/SEACrowd/sea-vl-image-collection/refs/heads/main/data/IMG_9284%20-%20B%C3%B6rje%20Karlsson.jpg,,Siem Reap's commerce and daily life.,Comércio e dia dia em Siem Reap.,Cambodia,"Siem Reap, Cambodia",Portuguese (por),
,,seacrowd.research@gmail.com,06/02/2025 00:00:00,06/02/2025 00:00:00,bulk_2642,https://raw.githubusercontent.com/SEACrowd/sea-vl-image-collection/refs/heads/main/data/IMG_9291%20-%20B%C3%B6rje%20Karlsson.jpg,,Bank of Cambodia building in Siem Reap.,Prédio do Banco do Cambodja em Siem Reap.,Cambodia,"Siem Reap, Cambodia",Portuguese (por),
,,seacrowd.research@gmail.com,06/02/2025 00:00:00,06/02/2025 00:00:00,bulk_2643,https://raw.githubusercontent.com/SEACrowd/sea-vl-image-collection/refs/heads/main/data/IMG_9295%20-%20B%C3%B6rje%20Karlsson.jpg,,Chicken Amok. Typical Cambodian dish.,Amok de galinha. Prato típico cambojano.,Cambodia,"Siem Reap, Cambodia",Portuguese (por),
,,seacrowd.research@gmail.com,06/02/2025 00:00:00,06/02/2025 00:00:00,bulk_2644,https://raw.githubusercontent.com/SEACrowd/sea-vl-image-collection/refs/heads/main/data/IMG_9298%20-%20B%C3%B6rje%20Karlsson.jpg,,Tut tuk through the streets of Siem Reap.,Tut tuk nas ruas de Siem Reap.,Cambodia,"Siem Reap, Cambodia",Portuguese (por),
,,seacrowd.research@gmail.com,06/02/2025 00:00:00,06/02/2025 00:00:00,bulk_2645,https://raw.githubusercontent.com/SEACrowd/sea-vl-image-collection/refs/heads/main/data/IMG_9402%20-%20B%C3%B6rje%20Karlsson.jpg,,Night view of Angkor Wat.,Vista noturna de Angkor Wat.,Cambodia,"Siem Reap, Cambodia",Portuguese (por),
,,seacrowd.research@gmail.com,06/02/2025 00:00:00,06/02/2025 00:00:00,bulk_2646,https://raw.githubusercontent.com/SEACrowd/sea-vl-image-collection/refs/heads/main/data/IMG_9430%20-%20B%C3%B6rje%20Karlsson.jpg,,Main entrance of Bakong.,Entrada principal de Bakong.,Cambodia,"Siem Reap, Cambodia",Portuguese (por),
,,seacrowd.research@gmail.com,06/02/2025 00:00:00,06/02/2025 00:00:00,bulk_2647,https://raw.githubusercontent.com/SEACrowd/sea-vl-image-collection/refs/heads/main/data/IMG_9453%20-%20B%C3%B6rje%20Karlsson.jpg,,Bakong side tower.,Torre lateral de Bakong.,Cambodia,"Siem Reap, Cambodia",Portuguese (por),
,,seacrowd.research@gmail.com,06/02/2025 00:00:00,06/02/2025 00:00:00,bulk_2648,https://raw.githubusercontent.com/SEACrowd/sea-vl-image-collection/refs/heads/main/data/IMG_9466%20-%20B%C3%B6rje%20Karlsson.jpg,,Monastery near Bakong.,Monastério próximo a Bakong.,Cambodia,"Siem Reap, Cambodia",Portuguese (por),
,,seacrowd.research@gmail.com,06/02/2025 00:00:00,06/02/2025 00:00:00,bulk_2649,https://raw.githubusercontent.com/SEACrowd/sea-vl-image-collection/refs/heads/main/data/IMG_9497%20-%20B%C3%B6rje%20Karlsson.jpg,,Preah Ko.,Preah Ko.,Cambodia,"Siem Reap, Cambodia",Portuguese (por),
,,seacrowd.research@gmail.com,06/02/2025 00:00:00,06/02/2025 00:00:00,bulk_2650,https://raw.githubusercontent.com/SEACrowd/sea-vl-image-collection/refs/heads/main/data/IMG_9526%20-%20B%C3%B6rje%20Karlsson.jpg,,"Lolei, not well taken care of...","Lolei, mal cuidado...",Cambodia,"Siem Reap, Cambodia",Portuguese (por),
,,seacrowd.research@gmail.com,06/02/2025 00:00:00,06/02/2025 00:00:00,bulk_2651,https://raw.githubusercontent.com/SEACrowd/sea-vl-image-collection/refs/heads/main/data/IMG_9558%20-%20B%C3%B6rje%20Karlsson.jpg,,"Path to Tep Pranam, guarded by traditional lions of the Khmer architecture.","Caminho pra Tep Pranam, guardado pelos tradicionais leões da arquitetura Khmer.",Cambodia,"Siem Reap, Cambodia",Portuguese (por),
,,seacrowd.research@gmail.com,06/02/2025 00:00:00,06/02/2025 00:00:00,bulk_2652,https://raw.githubusercontent.com/SEACrowd/sea-vl-image-collection/refs/heads/main/data/IMG_9568%20-%20B%C3%B6rje%20Karlsson.jpg,,Banteay Prei.,Banteay Prei.,Cambodia,"Siem Reap, Cambodia",Portuguese (por),
,,seacrowd.research@gmail.com,06/02/2025 00:00:00,06/02/2025 00:00:00,bulk_2653,https://raw.githubusercontent.com/SEACrowd/sea-vl-image-collection/refs/heads/main/data/IMG_9663%20-%20B%C3%B6rje%20Karlsson.jpg,,Aerial view of Angkor Wat.,Vista aérea de Angkot Wat.,Cambodia,"Siem Reap, Cambodia",Portuguese (por),
,,seacrowd.research@gmail.com,06/02/2025 00:00:00,06/02/2025 00:00:00,bulk_2654,https://raw.githubusercontent.com/SEACrowd/sea-vl-image-collection/refs/heads/main/data/IMG_9718%20-%20B%C3%B6rje%20Karlsson.jpg,,Battle scenes on the walls of Angkor Wat.,Cenas de batalhas nas paredes de Angkot Wat.,Cambodia,"Siem Reap, Cambodia",Portuguese (por),
,,seacrowd.research@gmail.com,06/02/2025 00:00:00,06/02/2025 00:00:00,bulk_2655,https://raw.githubusercontent.com/SEACrowd/sea-vl-image-collection/refs/heads/main/data/IMG_9785%20-%20B%C3%B6rje%20Karlsson.jpg,,"This mural shows the start of the Ramayama, an epic Indian poem. In it prince Rama (an incarnation of Vishnu) and his mokey army led by general Hanuman (the mokey king) fight against the demon Ravana. Their goals is to rescue Rama's wife, Sita, kept hostage in Lanka, Ravana's island-kingdom.","Aqui começa o Ramayama, um poema épico Indiano. Nele o príncipe Rama (uma incarnação de Vishnu) e seu exército de macacos liderado pelo general Hanuman (deus macaco) lutam com o demônio Ravana. Isso para resgatar a sua mulher Sita, mantida refém em Lanka, a ilha-reino de Ravana.",Cambodia,"Siem Reap, Cambodia",Portuguese (por),
,,seacrowd.research@gmail.com,06/02/2025 00:00:00,06/02/2025 00:00:00,bulk_2656,https://raw.githubusercontent.com/SEACrowd/sea-vl-image-collection/refs/heads/main/data/IMG_9803%20-%20B%C3%B6rje%20Karlsson.jpg,,Phnom Bakheng.,Phnom Bakheng.,Cambodia,"Siem Reap, Cambodia",Portuguese (por),
