annotation_id,annotator,email,created_at,timestamp,id,image,lead_time,text_cap_en,text_cap_native,text_culture_loc,text_image_loc,text_submitter_native_lang,updated_at
,,seacrowd.research@gmail.com,06/02/2025 00:00:00,06/02/2025 00:00:00,,https://raw.githubusercontent.com/SEACrowd/sea-vl-image-collection/refs/heads/main/data/6728_Image 3 - yeshil bangera.jpeg,,"The Golden Buddha, officially titled Phra Phuttha Maha Suwanna Patimakon, commonly known in Thai as Phra Sukhothai Traimit, is a gold Maravijaya Attitude seated Buddharupa statue, with a weight of 5.5 tonnes.","The Golden Buddha, officially titled Phra Phuttha Maha Suwanna Patimakon, commonly known in Thai as Phra Sukhothai Traimit, is a gold Maravijaya Attitude seated Buddharupa statue, with a weight of 5.5 tonnes.",Thailand,"Bangkok, Thailand",English,
,,seacrowd.research@gmail.com,06/02/2025 00:00:00,06/02/2025 00:00:00,,https://raw.githubusercontent.com/SEACrowd/sea-vl-image-collection/refs/heads/main/data/6729_IMG-20250202-WA0069 - Richardy Lobo Sapan.jpg,,"Leuit Hills in Majenang, Cilacap Regency, Central Java","Leuit Hills di Majenang, Kabupaten Cilacap, Jawa Tengah",Indonesia,"Majenang, Indonesia ",Indonesian (ind),
,,seacrowd.research@gmail.com,06/02/2025 00:00:00,06/02/2025 00:00:00,,https://raw.githubusercontent.com/SEACrowd/sea-vl-image-collection/refs/heads/main/data/6730_Image 4 - yeshil bangera.jpeg,,Pattaya is a city on Thailand’s eastern Gulf coast known for its beaches.,Pattaya is a city on Thailand’s eastern Gulf coast known for its beaches.,Thailand,"Pattaya City, Thailand",English,
,,seacrowd.research@gmail.com,06/02/2025 00:00:00,06/02/2025 00:00:00,,https://raw.githubusercontent.com/SEACrowd/sea-vl-image-collection/refs/heads/main/data/6731_Image5 - yeshil bangera.jpeg,,"Subway in Universal Studio, Singapore","Subway in Universal Studio, Singapore",Singapore,"Singapore, Singapore",English,
,,seacrowd.research@gmail.com,06/02/2025 00:00:00,06/02/2025 00:00:00,,https://raw.githubusercontent.com/SEACrowd/sea-vl-image-collection/refs/heads/main/data/6732_IMG-20250202-WA0074 - Richardy Lobo Sapan.jpg,,"View of Mount Slamet from the highway, the highest mountain in Central Java and the second highest mountain on the island of Java, after Mount Semeru","Pemandangan Gunung Slamet dari jalan raya, gunung tertinggi di Jawa Tengah dan gunung tertinggi kedua di pulau Jawa, setelah Gunung Semeru",Indonesia,"Jawa Tengah, Indonesia",Indonesian (ind),
,,seacrowd.research@gmail.com,06/02/2025 00:00:00,06/02/2025 00:00:00,,https://raw.githubusercontent.com/SEACrowd/sea-vl-image-collection/refs/heads/main/data/6733_Image6 - yeshil bangera.jpeg,,The Istana Negara is the official residence of the Yang di-Pertuan Agong.,The Istana Negara is the official residence of the Yang di-Pertuan Agong.,Malaysia,"Kuala Lumpur, Malaysia",English,
,,seacrowd.research@gmail.com,06/02/2025 00:00:00,06/02/2025 00:00:00,,https://raw.githubusercontent.com/SEACrowd/sea-vl-image-collection/refs/heads/main/data/6734_Image7 - yeshil bangera.jpeg,,The Istana Negara is the official residence of the Yang di-Pertuan Agong.,The Istana Negara is the official residence of the Yang di-Pertuan Agong.,Malaysia,"Kuala Lumpur, Malaysia",English,
,,seacrowd.research@gmail.com,06/02/2025 00:00:00,06/02/2025 00:00:00,,https://raw.githubusercontent.com/SEACrowd/sea-vl-image-collection/refs/heads/main/data/6735_Image8 - yeshil bangera.jpeg,,Popcorn Bus in Universal Studio Sinngapore,Popcorn Bus in Universal Studio Sinngapore,Singapore,"Singapore, Singapore",English,
,,seacrowd.research@gmail.com,06/02/2025 00:00:00,06/02/2025 00:00:00,,https://raw.githubusercontent.com/SEACrowd/sea-vl-image-collection/refs/heads/main/data/6736_Image9 - yeshil bangera.jpeg,,Street In universal Studio in Singapore,Street In universal Studio in Singapore,Singapore,"Singapore, Singapore",English,
,,seacrowd.research@gmail.com,06/02/2025 00:00:00,06/02/2025 00:00:00,,https://raw.githubusercontent.com/SEACrowd/sea-vl-image-collection/refs/heads/main/data/6737_IMG-20250202-WA0081 - Richardy Lobo Sapan.jpg,,"Sempol, Mini Pisang Molen, and Majenang's signature Wet Pangsit, traditional snacks from Indonesia","Sempol, Pisang Molen Mini, dan Pangsit Basah khas Majenang, jajanan tradisional asal Indonesia",Indonesia,"Majenang, Jawa Tengah",Indonesian (ind),
,,seacrowd.research@gmail.com,06/02/2025 00:00:00,06/02/2025 00:00:00,,https://raw.githubusercontent.com/SEACrowd/sea-vl-image-collection/refs/heads/main/data/6738_Image10 - yeshil bangera.jpeg,,Universal Studio Street Sign In Singapore,Universal Studio Street Sign In Singapore,Singapore,"Singapore, Singapore",English,
,,seacrowd.research@gmail.com,06/02/2025 00:00:00,06/02/2025 00:00:00,,https://raw.githubusercontent.com/SEACrowd/sea-vl-image-collection/refs/heads/main/data/6739_Image11 - yeshil bangera.jpeg,,Pattaya is a city on Thailand’s eastern Gulf coast known for its beaches.,Pattaya is a city on Thailand’s eastern Gulf coast known for its beaches.,Thailand,"Pataya City, Thailand",English,
,,seacrowd.research@gmail.com,06/02/2025 00:00:00,06/02/2025 00:00:00,,https://raw.githubusercontent.com/SEACrowd/sea-vl-image-collection/refs/heads/main/data/6740_Singapore1 - yeshil bangera.png,,Jurassic Park ride universal Studio Singapore,Jurassic Park ride universal Studio Singapore,Singapore,"Singapore, Singapore",English,
,,seacrowd.research@gmail.com,06/02/2025 00:00:00,06/02/2025 00:00:00,,https://raw.githubusercontent.com/SEACrowd/sea-vl-image-collection/refs/heads/main/data/6741_IMG-20250131-WA0014 - Richardy Lobo Sapan.jpg,,"Bajek Triangle from Gandang Batu, Toraja. Food made from sticky rice mixed with coconut milk and brown sugar","Bajek Segitiga dari Gandang Batu, Toraja. Makanan yang terbuat dari beras ketan yang dicampur santan dan gula merah",Indonesia,"Toraja, Indonesia",Indonesian (ind),
,,seacrowd.research@gmail.com,06/02/2025 00:00:00,06/02/2025 00:00:00,,https://raw.githubusercontent.com/SEACrowd/sea-vl-image-collection/refs/heads/main/data/6742_street1 - yeshil bangera.png,,Thailand bangkok Street,Thailand bangkok Street,Thailand,"Bangkok, Thailand",English,
,,seacrowd.research@gmail.com,06/02/2025 00:00:00,06/02/2025 00:00:00,,https://raw.githubusercontent.com/SEACrowd/sea-vl-image-collection/refs/heads/main/data/6743_street2 - yeshil bangera.png,,"Bangkok, Thailand Street","Bangkok, Thailand Street",Thailand,"Bangkok, Thailand",English,
,,seacrowd.research@gmail.com,06/02/2025 00:00:00,06/02/2025 00:00:00,,https://raw.githubusercontent.com/SEACrowd/sea-vl-image-collection/refs/heads/main/data/6744_1000139264 - Richardy Lobo Sapan.jpg,,"Rambu Solo', traditional funeral ceremony carried out by the Toraja tribe, South Sulawesi","Rambu Solo', upacara adat pemakaman yang dilakukan oleh Suku Toraja, Sulawesi Selatan",Indonesia,"Toraja, Indonesia",Indonesian (ind),
,,seacrowd.research@gmail.com,06/02/2025 00:00:00,06/02/2025 00:00:00,,https://raw.githubusercontent.com/SEACrowd/sea-vl-image-collection/refs/heads/main/data/6745_street3 - yeshil bangera.png,,Bangkok Thailand Street,Bangkok Thailand Street,Thailand,"Bangkok, Thailand",English,
,,seacrowd.research@gmail.com,06/02/2025 00:00:00,06/02/2025 00:00:00,,https://raw.githubusercontent.com/SEACrowd/sea-vl-image-collection/refs/heads/main/data/6746_IMG-20250204-WA0001 - Richardy Lobo Sapan.jpg,,"Lemo Tourist Attraction in North Toraja, South Sulawesi. This place is famous for its stone graves","Objek Wisata Lemo di Toraja Utara, Sulawesi Selatan. Tempat ini terkenal akan kuburan batunya",Indonesia,"Toraja, Indonesia",Indonesian (ind),
,,seacrowd.research@gmail.com,06/02/2025 00:00:00,06/02/2025 00:00:00,,https://raw.githubusercontent.com/SEACrowd/sea-vl-image-collection/refs/heads/main/data/6747_IMG-20250204-WA0003 - Richardy Lobo Sapan.jpg,,"Horse statue in Rantepao, North Toraja which is a characteristic of the place","Patung Kuda di Rantepao, Toraja Utara yang menjadi ciri khas tempat tersebut",Indonesia,"Toraja, Indonesia",Indonesian (ind),
,,seacrowd.research@gmail.com,06/02/2025 00:00:00,06/02/2025 00:00:00,,https://raw.githubusercontent.com/SEACrowd/sea-vl-image-collection/refs/heads/main/data/6748_Image1Comb - yeshil bangera.png,,"Ta Prohm is the modern name of a temple near the city of Siem Reap, Cambodia, approximately one kilometre east of Angkor Thom and on the southern edge of the East Baray.","Ta Prohm is the modern name of a temple near the city of Siem Reap, Cambodia, approximately one kilometre east of Angkor Thom and on the southern edge of the East Baray.",Cambodia,"Siem Reap, Cambodia",English,
,,seacrowd.research@gmail.com,06/02/2025 00:00:00,06/02/2025 00:00:00,,https://raw.githubusercontent.com/SEACrowd/sea-vl-image-collection/refs/heads/main/data/6749_IMG-20250204-WA0005 - Richardy Lobo Sapan.jpg,,"Fried Banana with Sambal, a habit of people in Eastern Indonesia to eat fried banana with chili sauce","Pisang Goreng dengan Sambal, kebiasaan orang di wilayah Indonesia bagian Timur untuk menyantap pisang goreng dengan sambal",Indonesia,"Jakarta, Indonesia",Indonesian (ind),
,,seacrowd.research@gmail.com,06/02/2025 00:00:00,06/02/2025 00:00:00,,https://raw.githubusercontent.com/SEACrowd/sea-vl-image-collection/refs/heads/main/data/6750_Image3 - yeshil bangera.png,,Angkor Wat is a Hindu-Buddhist temple complex in Cambodia,Angkor Wat is a Hindu-Buddhist temple complex in Cambodia,Cambodia,"Angkor, Cambodia",English,
,,seacrowd.research@gmail.com,06/02/2025 00:00:00,06/02/2025 00:00:00,,https://raw.githubusercontent.com/SEACrowd/sea-vl-image-collection/refs/heads/main/data/6751_1000143389 - Richardy Lobo Sapan.jpg,,Universitas Indonesia KRL Station,Stasiun KRL Universitas Indonesia ,Indonesia,"Depok, Indonesia",Indonesian (ind),
,,seacrowd.research@gmail.com,06/02/2025 00:00:00,06/02/2025 00:00:00,,https://raw.githubusercontent.com/SEACrowd/sea-vl-image-collection/refs/heads/main/data/6752_Image1 - yeshil bangera.png,,Angkor Wat is a Hindu-Buddhist temple complex in Cambodia,Angkor Wat is a Hindu-Buddhist temple complex in Cambodia,Cambodia,"Angkor, Cambodia",English,
,,seacrowd.research@gmail.com,06/02/2025 00:00:00,06/02/2025 00:00:00,,https://raw.githubusercontent.com/SEACrowd/sea-vl-image-collection/refs/heads/main/data/6753_Image2 - yeshil bangera.png,,"Ta Keo is a temple-mountain in Angkor, possibly the first to be built entirely of sandstone by the Khmer Empire.","Ta Keo is a temple-mountain in Angkor, possibly the first to be built entirely of sandstone by the Khmer Empire.",Cambodia,"Krong Siem Reap, Cambodia",English,
,,seacrowd.research@gmail.com,06/02/2025 00:00:00,06/02/2025 00:00:00,,https://raw.githubusercontent.com/SEACrowd/sea-vl-image-collection/refs/heads/main/data/6754_Image33 - yeshil bangera.png,,Buddhist celestial being or Apsara found in a temple in Cambodia. ,Buddhist celestial being or Apsara found in a temple in Cambodia. ,Cambodia,"Krong Siem Reap, Cambodia",English,
,,seacrowd.research@gmail.com,06/02/2025 00:00:00,06/02/2025 00:00:00,,https://raw.githubusercontent.com/SEACrowd/sea-vl-image-collection/refs/heads/main/data/6755_Image44 - yeshil bangera.png,,The Bayon is a richly decorated Khmer temple related to Buddhism at Angkor in Cambodia,The Bayon is a richly decorated Khmer temple related to Buddhism at Angkor in Cambodia,Cambodia,"Angkor, Combodia",English,
,,seacrowd.research@gmail.com,06/02/2025 00:00:00,06/02/2025 00:00:00,,https://raw.githubusercontent.com/SEACrowd/sea-vl-image-collection/refs/heads/main/data/6756_comb11 - yeshil bangera.png,,The Royal Palace of Cambodia is a complex of buildings which serves as the official royal residence of the King of Cambodia. Its full name in Khmer is the Preah Barom Reacheaveang Chaktomuk Serey Mongkol.,The Royal Palace of Cambodia is a complex of buildings which serves as the official royal residence of the King of Cambodia. Its full name in Khmer is the Preah Barom Reacheaveang Chaktomuk Serey Mongkol.,Cambodia,"Phnom Penh, Cambodia",English,
,,seacrowd.research@gmail.com,06/02/2025 00:00:00,06/02/2025 00:00:00,,https://raw.githubusercontent.com/SEACrowd/sea-vl-image-collection/refs/heads/main/data/6757_comb12 - yeshil bangera.png,,"Ta Prohm is the modern name of a temple near the city of Siem Reap, Cambodia, ","Ta Prohm is the modern name of a temple near the city of Siem Reap, Cambodia, ",Cambodia,"Siem Reap, Cambodia",English,
,,seacrowd.research@gmail.com,06/02/2025 00:00:00,06/02/2025 00:00:00,,https://raw.githubusercontent.com/SEACrowd/sea-vl-image-collection/refs/heads/main/data/6758_comb13 - yeshil bangera.png,,"Ta Prohm is the modern name of a temple near the city of Siem Reap, Cambodia, ","Ta Prohm is the modern name of a temple near the city of Siem Reap, Cambodia, ",Cambodia,"Siem Reap, Cambodia",English,
,,seacrowd.research@gmail.com,06/02/2025 00:00:00,06/02/2025 00:00:00,,https://raw.githubusercontent.com/SEACrowd/sea-vl-image-collection/refs/heads/main/data/6759_IMG-20230802-WA0000 - Richardy Lobo Sapan.jpg,,Indonesian eating habits: eating with hands,Kebiasaan makan orang Indonesia: makan dengan tangan,Indonesia,"Depok, Indonesia",Indonesian (ind),
,,seacrowd.research@gmail.com,06/02/2025 00:00:00,06/02/2025 00:00:00,,https://raw.githubusercontent.com/SEACrowd/sea-vl-image-collection/refs/heads/main/data/6760_1000143405 - Richardy Lobo Sapan.jpg,,The culture of wrapping food remains in Indonesia,Budaya membungkus makanan tersisa di Indonesia,Indonesia,"Depok, Indonesia",Indonesian (ind),
,,seacrowd.research@gmail.com,06/02/2025 00:00:00,06/02/2025 00:00:00,,https://raw.githubusercontent.com/SEACrowd/sea-vl-image-collection/refs/heads/main/data/6761_IMG-20250204-WA0013 - Richardy Lobo Sapan.jpg,,"Jakarta Cathedral Church, or officially named The Church of Our Lady of the Assumption, is a Catholic cathedral church located in Central Jakarta, Jakarta, the capital of Indonesia.","Gereja Katedral Jakarta, atau bernama resmi Gereja Katedral Santa Perawan Maria Diangkat ke Surga adalah sebuah gereja katedral Katolik yang terletak di Jakarta Pusat, Jakarta, ibu kota Indonesia.",Indonesia,"Jakarta, Indonesia",Indonesian (ind),
,,seacrowd.research@gmail.com,06/02/2025 00:00:00,06/02/2025 00:00:00,,https://raw.githubusercontent.com/SEACrowd/sea-vl-image-collection/refs/heads/main/data/6762_IMG-20250204-WA0017 - Richardy Lobo Sapan.jpg,,"The Kota Tua in Jakarta, is centered on Alun-Alun Fatahillah, which is a busy square with regular performances of traditional dances.","Kota tua di Jakarta, yang berpusat di Alun-Alun Fatahillah, yaitu alun-alun yang ramai dengan pertunjukan rutin tarian tradisional",Indonesia,"Jakarta, Indonesia",Indonesian (ind),
,,seacrowd.research@gmail.com,06/02/2025 00:00:00,06/02/2025 00:00:00,,https://raw.githubusercontent.com/SEACrowd/sea-vl-image-collection/refs/heads/main/data/6763_IMG-20250204-WA0021 - Richardy Lobo Sapan.jpg,,"The West Irian Liberation Monument, a monument built to commemorate the Trikora fighters and the people of West Irian who chose to become part of the Republic of Indonesia","Monumen Pembebasan Irian Barat, monumen yang dibangun untuk mengenang para pejuang Trikora dan masyarakat Irian Barat yang memilih menjadi bagian dari Republik Indonesia",Indonesia,"Jakarta, Indonesia",Indonesian (ind),
,,seacrowd.research@gmail.com,06/02/2025 00:00:00,06/02/2025 00:00:00,,https://raw.githubusercontent.com/SEACrowd/sea-vl-image-collection/refs/heads/main/data/6764_IMG-20250204-WA0025 - Richardy Lobo Sapan.jpg,,Universitas Indonesia Library,Perpustakaan Universitas Indonesia,Indonesia,"Depok, Indonesia",Indonesian (ind),
,,seacrowd.research@gmail.com,06/02/2025 00:00:00,06/02/2025 00:00:00,,https://raw.githubusercontent.com/SEACrowd/sea-vl-image-collection/refs/heads/main/data/6765_1000143475 - Richardy Lobo Sapan.jpg,,Crowds at the Gelora Bung Karno Main Stadium,Keramaian di Stadion Utama Gelora Bung Karno,Indonesia,"Jakarta, Indonesia",Indonesian (ind),
,,seacrowd.research@gmail.com,06/02/2025 00:00:00,06/02/2025 00:00:00,,https://raw.githubusercontent.com/SEACrowd/sea-vl-image-collection/refs/heads/main/data/6766_IMG-20241030-WA0020 - Richardy Lobo Sapan.jpg,,"Toraja Church Cilodong Congregation in Cilodong, Depok","Gereja Toraja Jemaat Cilodong di Cilodong, Depok",Indonesia,"Depok, Indonesia",Indonesian (ind),
,,seacrowd.research@gmail.com,06/02/2025 00:00:00,06/02/2025 00:00:00,,https://raw.githubusercontent.com/SEACrowd/sea-vl-image-collection/refs/heads/main/data/6767_IMG-20250204-WA0033 - Richardy Lobo Sapan.jpg,,Hutan Kota Universitas Indonesia,Hutan Kota Universitas Indonesia,Indonesia,"Depok, Indonesia",Indonesian (ind),
,,seacrowd.research@gmail.com,06/02/2025 00:00:00,06/02/2025 00:00:00,,https://raw.githubusercontent.com/SEACrowd/sea-vl-image-collection/refs/heads/main/data/6768_IMG-20250204-WA0042 - Richardy Lobo Sapan.jpg,,"Es Pisang Ijo, a type of typical food from the Makassar tribe in South Sulawesi, especially in the city of Makassar. This food is made from the main ingredient of bananas coated with green flour dough.","Es Pisang ijo, sejenis makanan khas Suku Makassar di Sulawesi Selatan, terutama di kota Makassar. Makanan ini terbuat dari bahan utama pisang yang dibalut dengan adonan tepung berwarna hijau.",Indonesia,Jakarta. Indonesia,Indonesian (ind),
,,seacrowd.research@gmail.com,06/02/2025 00:00:00,06/02/2025 00:00:00,,https://raw.githubusercontent.com/SEACrowd/sea-vl-image-collection/refs/heads/main/data/6769_IMG-20250204-WA0040 - Richardy Lobo Sapan.jpg,,"Pallu basa, traditional food of the Makassar tribe, South Sulawesi. Pallu basa is made from the innards (intestines) of cows or buffalo.","Pallu basa, makanan tradisional Suku Makassar, Sulawesi Selatan. Pallu basa terbuat dari jeroan (isi dalam perut) sapi atau kerbau.",Indonesia,"Jakarta, Indonesia",Indonesian (ind),
,,seacrowd.research@gmail.com,06/02/2025 00:00:00,06/02/2025 00:00:00,,https://raw.githubusercontent.com/SEACrowd/sea-vl-image-collection/refs/heads/main/data/6770_IMG-20250204-WA0044 - Richardy Lobo Sapan.jpg,,"Es Potong/Es Goreng/Es Tongtong, traditional Indonesian ice cream that is skewered and covered in chocolate","Es Potong/Es Goreng/Es Tongtong, es krim tradisional Indonesia yang ditusuk dan dilumuri cokelat",Indonesia,"Depok, Indonesia",Indonesian (ind),
,,seacrowd.research@gmail.com,06/02/2025 00:00:00,06/02/2025 00:00:00,,https://raw.githubusercontent.com/SEACrowd/sea-vl-image-collection/refs/heads/main/data/6771_IMG-20250204-WA0050 - Richardy Lobo Sapan.jpg,,"Bogor Presidential Palace, one of the six Presidential Palaces of the Republic of Indonesia which is unique due to its historical, cultural and faunal aspects","Istana Bogor, salah satu dari enam Istana Presiden Republik Indonesia yang mempunyai keunikan tersendiri dikarenakan aspek historis, kebudayaan, dan faunanya",Indonesia,"Bogor, Indonesia",Indonesian (ind),
,,seacrowd.research@gmail.com,06/02/2025 00:00:00,06/02/2025 00:00:00,,https://raw.githubusercontent.com/SEACrowd/sea-vl-image-collection/refs/heads/main/data/6772_IMG-20250204-WA0052 - Richardy Lobo Sapan.jpg,,UI Store inside Universitas Indonesia Library,UI Store di dalam perpustakaan Universitas Indonesia,Indonesia,"Jakarta, Indonesia",Indonesian (ind),
,,seacrowd.research@gmail.com,06/02/2025 00:00:00,06/02/2025 00:00:00,,https://raw.githubusercontent.com/SEACrowd/sea-vl-image-collection/refs/heads/main/data/6773_WhatsApp Image 2025-02-04 at 08.34.56_80a0d293 - Tirana Noor Fatyanosa.jpg,,"Chocolate Dadar Gulung is a variation of a traditional Indonesian snack made from a crepe-like wrapper made with flour and cocoa, filled with grated coconut cooked in palm sugar.","Dadar Gulung Coklat adalah variasi jajanan tradisional Indonesia yang terbuat dari kulit dadar berbahan tepung terigu dan kakao, diisi dengan kelapa parut yang dimasak dengan gula merah.",Indonesia,"Malang, Indonesia",Indonesian (ind),
,,seacrowd.research@gmail.com,06/02/2025 00:00:00,06/02/2025 00:00:00,,https://raw.githubusercontent.com/SEACrowd/sea-vl-image-collection/refs/heads/main/data/6774_WhatsApp Image 2025-02-04 at 08.34.56_ed37e712 - Tirana Noor Fatyanosa.jpg,,"Kue Lumpur is a traditional Indonesian cake made from a mixture of flour, coconut milk, potatoes, sugar, and eggs, resulting in a soft texture with a sweet and savory flavor.","Kue Lumpur adalah kue tradisional Indonesia yang terbuat dari campuran tepung terigu, santan, kentang, gula, dan telur, menghasilkan tekstur lembut dan rasa manis gurih. ",Indonesia,"Malang, Indonesia",Indonesian (ind),
,,seacrowd.research@gmail.com,06/02/2025 00:00:00,06/02/2025 00:00:00,,https://raw.githubusercontent.com/SEACrowd/sea-vl-image-collection/refs/heads/main/data/6775_WhatsApp Image 2025-02-04 at 08.34.57_d9220679 - Tirana Noor Fatyanosa.jpg,,"Potato Croquette is a popular Indonesian snack made from mashed potato dough filled with seasoned chicken or minced meat ragout, shaped into oval balls, coated with breadcrumbs, and deep-fried until crispy. ","Kroket Kentang adalah camilan khas Indonesia yang terbuat dari adonan kentang tumbuk yang diisi dengan ragout ayam atau daging cincang berbumbu, dibentuk bulat lonjong, dilapisi tepung panir, dan digoreng hingga renyah. ",Indonesia,"Malang, Indonesia",Indonesian (ind),
,,seacrowd.research@gmail.com,06/02/2025 00:00:00,06/02/2025 00:00:00,,https://raw.githubusercontent.com/SEACrowd/sea-vl-image-collection/refs/heads/main/data/6776_Screenshot 2025-02-04 150039 - Tirana Noor Fatyanosa.jpg,,"Kerupuk is a traditional Indonesian snack made from tapioca flour mixed with additional ingredients like shrimp, fish, or garlic, then dried and deep-fried until crispy.","Kerupuk adalah makanan ringan khas Indonesia yang terbuat dari adonan tepung tapioka dan bahan tambahan seperti udang, ikan, atau bawang putih, kemudian dikeringkan dan digoreng hingga renyah.",Indonesia,"Malang, Indonesia",Indonesian (ind),
,,seacrowd.research@gmail.com,06/02/2025 00:00:00,06/02/2025 00:00:00,,https://raw.githubusercontent.com/SEACrowd/sea-vl-image-collection/refs/heads/main/data/6777_1000143418 - Richardy Lobo Sapan.jpg,,"The process of making a lakkian, a building erected as a place to place a chest","Proses pembuatan lakkian, sebuah bangunan yang didirikan sebagai tempat untuk meletakkan peti",Indonesia,"Toraja, Indonesia",Indonesian (ind),
,,seacrowd.research@gmail.com,06/02/2025 00:00:00,06/02/2025 00:00:00,,https://raw.githubusercontent.com/SEACrowd/sea-vl-image-collection/refs/heads/main/data/6778_IMG-20250204-WA0055 - Richardy Lobo Sapan.jpg,,Buildings in Sudirman Central Business District (SCBD) at night,Gedung-gedung di Sudirman Central Business District (SCBD) pada malam hari,Indonesia,"Jakarta, Indonesia",Indonesian (ind),
,,seacrowd.research@gmail.com,06/02/2025 00:00:00,06/02/2025 00:00:00,,https://raw.githubusercontent.com/SEACrowd/sea-vl-image-collection/refs/heads/main/data/6779_Screenshot 2025-02-04 153134 - Tirana Noor Fatyanosa.png,,"Kentang Balado is a traditional Indonesian dish, particularly from West Sumatra, made of fried potato chunks cooked in balado sauce. The sauce is a blend of red chili, shallots, garlic, and tomatoes, creating a spicy, savory, and slightly sweet flavor.","Kentang Balado adalah hidangan khas Indonesia, khususnya dari Sumatra Barat, yang terdiri dari potongan kentang goreng yang dimasak dengan bumbu balado. Bumbu balado terbuat dari cabai merah, bawang merah, bawang putih, dan tomat, menghasilkan rasa pedas, gurih, dan sedikit manis.",Indonesia,"Malang, Indonesia",Indonesian (ind),
,,seacrowd.research@gmail.com,06/02/2025 00:00:00,06/02/2025 00:00:00,,https://raw.githubusercontent.com/SEACrowd/sea-vl-image-collection/refs/heads/main/data/6780_Screenshot 2025-02-04 153535 - Tirana Noor Fatyanosa.png,,"Tumis Labu Siam is a simple Indonesian dish made from chayote sautéed with spices such as garlic, shallots, chili, and a hint of shrimp paste. ","Tumis Labu Siam adalah hidangan sederhana khas Indonesia yang terbuat dari labu siam yang ditumis bersama bumbu seperti bawang putih, bawang merah, cabai, dan sedikit terasi.",Indonesia,"Malang, Indonesia",Indonesian (ind),
,,seacrowd.research@gmail.com,06/02/2025 00:00:00,06/02/2025 00:00:00,,https://raw.githubusercontent.com/SEACrowd/sea-vl-image-collection/refs/heads/main/data/6781_IMG-20250204-WA0056 - Richardy Lobo Sapan.jpg,,"Makan Bareng or Makan Liwetan, a tradition of eating together with rice and side dishes arranged on banana leaves or oil paper, then eaten together without using a plate, but directly with your hands","Makan Bareng atau Makan Liwetan, tradisi makan bersama dengan nasi dan lauk yang disusun di atas daun pisang atau kertas minyak, lalu disantap bersama-sama tanpa menggunakan piring, melainkan langsung dengan tangan",Indonesia,"Depok, Indonesia",Indonesian (ind),
,,seacrowd.research@gmail.com,06/02/2025 00:00:00,06/02/2025 00:00:00,,https://raw.githubusercontent.com/SEACrowd/sea-vl-image-collection/refs/heads/main/data/6782_IMG-20250204-WA0058 - Richardy Lobo Sapan.jpg,,"Tempe Sambal, typical Indonesian home food","Tempe Sambal, makanan rumahan khas Indonesia",Indonesia,"Depok, Indonesia",Indonesian (ind),
,,seacrowd.research@gmail.com,06/02/2025 00:00:00,06/02/2025 00:00:00,,https://raw.githubusercontent.com/SEACrowd/sea-vl-image-collection/refs/heads/main/data/6783_IMG-20250204-WA0060 - Richardy Lobo Sapan.jpg,,Various Batiks in a Batik Selling Shop in Jakarta,Beragam Batik di sebuah Toko Penjual Batik di Jakarta,"Brunei, East Timor, Indonesia, Malaysia, Singapore","Jakarta, Indonesia",Indonesian (ind),
