,language,page_url,image_url,page_title,section_title,hierarchical_section_title,caption_reference_description,caption_attribution_description,caption_alt_text_description,mime_type,original_height,original_width,is_main_image,attribution_passes_lang_id,page_changed_recently,context_page_description
167,id,https://id.wikipedia.org/wiki/Willem_Rooseboom,https://upload.wikimedia.org/wikipedia/commons/5/52/Rooseboom%2C_W._Luitenant_generaal.jpg,Willem Rooseboom,,Willem Rooseboom,Willem Rooseboom,English: Gouverneur generaal W. Rooseboom,,image/jpeg,2573,2293,True,True,True,"Willem Rooseboom adalah seorang Gubernur-Jenderal Hindia Belanda.
Ia memerintah antara tanggal 3 Oktober 1899 sampai tanggal 1 Oktober 1904."
168,vi,https://vi.wikipedia.org/wiki/%C3%9D,https://upload.wikimedia.org/wikipedia/commons/0/00/Italian-unification.gif,Ý,Thống nhất,Ý / Lịch sử / Thống nhất,"Bản đồ ảnh động về quá trình thống nhất nước Ý, từ 1829 đến 1871",English: 1829-1871,,image/gif,640,640,True,True,True,"Ý hay Italia tên chính thức là nước Cộng hoà Ý là một nước cộng hoà nghị viện đơn nhất tại châu Âu. Lãnh thổ Ý vươn ra phần trung tâm của Địa Trung Hải, hai đảo lớn nhất là Sicilia và Sardegna. Dãy Alpes/Alpi giới hạn phần lục địa phía Bắc của Ý, tạo thành biên giới trên bộ với Pháp, Thụy Sĩ, Áo, Slovenia, trong khi San Marino và Vatican nằm lọt trong nước cộng hoà. Ý có diện tích là 301.338 km², và phần lớn có khí hậu ôn đới theo mùa và Địa Trung Hải. Do hình dạng lãnh thổ, Ý thường được ví như lo Stivale. Dân số Ý đạt khoảng 60 triệu người, là quốc gia đông dân thứ ba trong Liên minh châu Âu. Thủ đô của Ý là Roma, các vùng đô thị lớn khác là Milano, Napoli, Torino.
Đến thế kỷ I TCN, Đế quốc La Mã nổi lên thành thế lực chi phối tại bồn địa Địa Trung Hải, trở thành trung tâm lãnh đạo về văn hoá, chính trị và tôn giáo của văn minh phương Tây trong thời kỳ cổ đại. Di sản của đế quốc này được phổ biến và có thể nhận thấy trong luật dân sự, chính phủ cộng hoà, Cơ Đốc giáo và chữ cái Latinh trên toàn cầu."
169,id,https://id.wikipedia.org/wiki/H%E1%BB%99i_An,https://upload.wikimedia.org/wikipedia/commons/7/7b/Ch%C3%B9a_C%E1%BA%A7u%2C_H%E1%BB%99i_An%2C_from_an_angle.jpg,Hội An,,Hội An,,"English: Japanese bridge, Hội An","Jembatan Jepang, lambang Hội An",image/jpeg,4924,7374,True,True,True,"Hội An, juga Fai-Fo atau Faifoo, adalah sebuah kota di Vietnam, yang terletak di pesisir Laut China Selatan di wilayah Pesisir Tengah Selatan, di Provinsi Quảng Nam.
Dengan sekitar 120,000 penduduk, Hội An diangkat sebagai Situs Warisan Dunia oleh UNESCO."
170,vi,https://vi.wikipedia.org/wiki/Phan_Xi_P%C4%83ng,https://upload.wikimedia.org/wikipedia/commons/a/a2/Cable_car_station_going_Fansipan.jpg,Phan Xi Păng,Tàu hỏa leo núi Mường Hoa,Phan Xi Păng / Tàu hỏa leo núi Mường Hoa,Nhà ga tàu hỏa lên Fansipan,Tiếng Việt: Nhà ga cáp treo lên đỉnh Fansipan,,image/jpeg,2916,5184,True,True,True,"Phan Xi Păng, Fansipan, hay Phan Si Păng là ngọn núi cao nhất Việt Nam, cũng là cao nhất trong ba nước Đông Dương nên được mệnh danh là ""Nóc nhà Đông Dương"" thuộc dãy núi Hoàng Liên Sơn, cách trung tâm thị xã Sa Pa khoảng 9 km về phía tây nam, nằm giáp hai tỉnh Lào Cai và Lai Châu thuộc vùng Tây bắc Việt Nam. Theo tiếng địa phương, núi tên là ""Hủa Xi Pan"" và có nghĩa là phiến đá khổng lồ chênh vênh. Chiều cao của đỉnh núi đo đạc năm 1909 là 3.143 m, tuy vậy theo số liệu mới nhất của Cục Đo đạc, bản đồ và thông tin địa lý Việt Nam đưa ra vào cuối tháng 6 năm 2019, đỉnh núi cao 3.147,3m."
171,id,https://id.wikipedia.org/wiki/Sarawak,https://upload.wikimedia.org/wikipedia/commons/c/c1/Borneo_19_May_2002.jpg,Sarawak,Geografi,Sarawak / Lingkungan hidup / Geografi,Sarawak terletak di barat laut Borneo seperti yang terlihat dari citra satelit NASA.,"English: These true-color images of Indonesia were acquired by the Moderate Resolution Imaging Spectroradiometer in mid-May 2002. Fire season was not fully underway in the region, and skies over the large island of Borneo, with Malaysia at its northwest coast, are cloud-covered, but not hazy with air pollution. The horizontally situated island of java appears to be experiencing some haze at its western end, and a few scattered fires (red dots) were detected. These images were acquired on May 17 and 19, 2002.",,image/jpeg,5800,4400,True,True,True,"Sarawak adalah salah satu negara bagian Malaysia. Negara bagian tersebut memiliki otonomi dalam pemerintahan, imigrasi, dan yudisier yang berbeda dari negara-negara bagian di Semenanjung Malaysia. Sarawak terletak di barat laut Borneo dan berbatasan dengan Sabah di timur laut, Kalimantan, bagian Indonesia dari Borneo di bagian selatan, dan berpapasan dengan Brunei. Ibu kotanya, Kuching, adalah pusat ekonomi negara bagian tersebut dan kursi dari pemerintahan negara bagian Sarawak. Kota lainnya di Sarawak meliputi Miri, Sibu, dan Bintulu. Menurut sensus 2015 di Malaysia, populasi di negara bagian tersebut sejumlah 2.636.000 orang. Sarawak memiliki iklim khatulistiwa dengan hutan hujan tropis dan spesies hewan dan tumbuhan yang beragam. Negara bagian tersebut memiliki beberapa sistem gua penting di Taman Nasional Gunung Mulu. Sungai Rajang adalah sungai terpanjang di Malaysia; Bendungan Bakun, salah satu bendungan terbesar di Asia Tenggara, terletak di salah satu anak sungainya. Gunung Murud adalah titik tertinggi di Sarawak.
Pemukiman manusia terawal di Sarawak bermula dari 40,000 tahun yang lalu di Gua-Gua Niah."
172,id,https://id.wikipedia.org/wiki/Ubin,https://upload.wikimedia.org/wikipedia/commons/e/e6/Nazar%C3%A906.jpg,Ubin,,Ubin,"Azulejo karya Willem van der Kloet (1708) dalam transept dari Gereja Nossa Senhora da Nazaré, Nazaré, Portugal","Transept in the Church of Nossa Senhora da Nazaré — in Nazaré, Leiria district, Portugal. With an Azulejo tiled wall, and abstract pattern stained glass windows.",,image/jpeg,1280,960,True,True,True,"Ubin adalah objek tipis yang biasanya berbentuk persegi atau persegi panjang. Ubin merupakan potongan yang diproduksi dari bahan tahan pakai yang keras seperti keramik, batu, logam, tanah liat yang dipanggang, atau bahkan kaca, yang pada umumnya digunakan untuk menutupi atau melapisi atap, lantai, dinding, atau benda lain seperti permukaan meja. Ubin juga terkadang dapat merujuk pada benda serupa yang terbuat dari bahan ringan seperti perlite, kayu, dan wol mineral, biasanya digunakan untuk dinding atau langit-langit. Kata ubin juga digunakan untuk benda atau susunan berbentuk persegi yang menyerupai ubin dalam istilah permainan. Kata ini berasal dari bahasa Prancis yaitu tuile, dan juga dari bahasa Latin tegula, yang berarti ubin atap yang terbuat dari lempung yang dibakar.
Ubin sering digunakan untuk pelapis dinding dan lantai, mulai dari bentuk ubin persegi sederhana hingga kompleks atau mosaik. Ubin umumnya dibuat dari tembikar, biasanya berlapis kaca untuk penggunaan internal dan tanpa glasir untuk atap, tetapi bahan lain juga biasa digunakan, seperti kaca, gabus, beton, batu dan bahan komposit lainnya. Batu ubin biasanya terbuat dari marmer, onyx, granit atau batu tulis."
173,ceb,https://ceb.wikipedia.org/wiki/Sawbwa_resplendens,https://upload.wikimedia.org/wikipedia/commons/7/72/Sawbwa_resplendens.jpg,Sawbwa resplendens,,Sawbwa resplendens,,English: Young male Sawbwa resplendens. Aquarium photo.,,image/jpeg,419,761,True,True,True,Espesye sa isda ang Sawbwa resplendens. Una ning gihulagway ni Annandale ni adtong 1918. Ang Sawbwa resplendens sakop sa kahenera nga Sawbwa sa kabanay nga karpa. Giklaseklase sa IUCN ang espesye sa nagtikapuo. Pagka karon wala pay siak nga nalista ubos niini niya.
174,id,https://id.wikipedia.org/wiki/V._K._Krishna_Menon,http://upload.wikimedia.org/wikipedia/commons/d/de/Krishna_Menon.jpg,V. K. Krishna Menon,,V. K. Krishna Menon,Krishna Menon pada 1950,English: V. K. Krishna Menon in October 1950,,image/jpeg,766,626,True,True,True,"Vengalil Krishnan Krishna Menon adalah seorang nasionalis, diplomat dan politikus asal India. Ia dianggap beberapa orang sebagai orang paling berkuasa kedua di India India setelah Jawaharlal Nehru."
175,fil,"https://tl.wikipedia.org/wiki/Quezon,_Bukidnon",http://upload.wikimedia.org/wikipedia/commons/b/be/Quezon%2C_Bukidnon_overview.JPG,"Quezon, Bukidnon",,"Quezon, Bukidnon",,"English: Overview at Quezon, Bukidnon",,image/jpeg,1536,2048,True,True,True,"Ang Bayan ng Quezon ay isang unang klaseng bayan sa lalawigan ng Bukidnon, Pilipinas. Ayon sa 2015 senso, ito ay may populasyon na 104,116 sa may 22,903 na kabahayan."
176,ceb,"https://ceb.wikipedia.org/wiki/Sitangkai,_Tawi-Tawi",https://upload.wikimedia.org/wikipedia/commons/7/77/Ph_locator_tawi-tawi_sitangkai.png,"Sitangkai, Tawi-Tawi",,"Sitangkai, Tawi-Tawi",,English: Map of the Tawi-Tawi showing the location of Sitangkai,Mapa sa Tawi-Tawi nga nagpakita sa nahimutangan sa Sitangkai.,image/png,250,300,True,True,True,"Ang Sitangkai usa ka lungsod sa lalawigan sa Tawi-Tawi sa Pilipinas. Kini ang kinahabagatang lungsod sa Pilipinas. Kini nahimutang 14 kilometros lamang gikan sa sidlakang baybayon sa Sabah, Malasya. Kini gitawag nga 'Venice' sa Pilipinas tungod sa paggamit sa baroto isip paagi sa transportasyon. Ang nag-unang gigikanan sa panginabuhi mao ang pagpangisda ug pagpanguma, bisan kon gamay lamang kaayo ang mahimong umahon.
Sumala sa sensus sa tuig 2000, ang Sitangkai may populasyon nga 52,772
ka tawo sa 8,969
ka bubong."
177,id,https://id.wikipedia.org/wiki/Curtis_LeMay,https://upload.wikimedia.org/wikipedia/commons/f/fb/Twentieth_Air_Force_-_Emblem.png,Curtis LeMay,,Curtis LeMay,,Emblem of the 20th Air Force of the United States Air Force,,image/png,1000,977,True,True,True,"Curtis Emerson LeMay adalah seorang jenderal dalam Angkatan Udara Amerika Serikat dan calon wakil presiden dari kandidat Partai Independen Amerika George Wallace dalam pemilihan presiden 1968.
Curtis LeMay dikenal karena merancang dan mengimplementasikan kampanye pengeboman strategis sistematis, efektif namun juga kontroversial di teater Pasifik saat Perang Dunia II. Pada masa perang tersebut, ia dikenal karena merencanakan dan mengeksekusi kampanye pengeboman masif terhadap kota-kota di Jepang. Ia menjabat sebagai Ketua Staf Angkatan Udara AS dari 1961 sampai ia pensiun pada 1965."
178,vi,https://vi.wikipedia.org/wiki/Presbytis_melalophos,https://upload.wikimedia.org/wikipedia/commons/4/48/Semnopithecus_sumatranus.jpg,Presbytis melalophos,,Presbytis melalophos,,English: Semnopithecus sumatranus = Presbytis melalophos sumatranus (sumatran surili) Français&#160;: Semnopithecus sumatranus = Presbytis melalophos sumatranus (Semnopithèque de Sumatra),,image/jpeg,708,461,True,True,True,"Presbytis melalophos là một loài động vật có vú trong họ Cercopithecidae, bộ Linh trưởng. Loài này được Raffles mô tả năm 1821."
179,vi,https://vi.wikipedia.org/wiki/Nam_K%E1%BB%B3,https://upload.wikimedia.org/wikipedia/commons/d/d6/NamKy1832-1841.jpg,Nam Kỳ,Thời Triều Nguyễn tự chủ,Nam Kỳ / Các đơn vị hành chính / Thời Triều Nguyễn tự chủ,"Đất Nam Kỳ vào đầu thời nhà Nguyễn, cho đến trước năm 1841.",Tiếng Việt: Các tỉnh thành phía Nam - Việt Nam giai đoạn 1832-1841 English: Provinces and cities in South - Vietnam during the period 1832-1841,,image/jpeg,525,554,True,True,True,"Nam Kỳ là lãnh thổ cực Nam của nước Đại Nam triều Nguyễn, là một trong ba kỳ hợp thành nước Việt Nam. Tên gọi này do vua Minh Mạng đặt ra năm 1832. Sau khi Việt Nam giành được độc lập năm 1945, Nam Kỳ bắt đầu được gọi là Nam Bộ, trong giai đoạn 1948–1954 thường gọi là Nam Việt.
Trong thời kỳ Pháp thôn tính Việt Nam, theo chính sách ""chia để trị"", Việt Nam bị chia cắt thành 3 xứ riêng biệt: xứ thuộc địa Nam Kỳ và hai xứ bảo hộ Bắc Kỳ và Trung Kỳ. Danh xưng Nam Kỳ được chính quyền Liên bang Đông Dương của Pháp duy trì cho đến năm 1945. Quốc gia Việt Nam và Việt Nam Cộng hòa cũng dùng tên gọi Nam phần, vốn đã được sử dụng từ năm 1947 trong giai đoạn sau của Cộng hòa Tự trị Nam Kỳ. Diện tích Nam Kỳ là 67.293,1 km².
Hiện nay, danh xưng này không còn được sử dụng về mặt hành chính do mang tính phân biệt, gây chia rẽ vùng miền."
180,vi,https://vi.wikipedia.org/wiki/M%E1%BA%ABu_Th%C6%B0%E1%BB%A3ng_Thi%C3%AAn,https://upload.wikimedia.org/wikipedia/commons/2/23/Mother_Goddess_of_Heaven_M%E1%BA%ABu_Th%C6%B0%E1%BB%A3ng_Thi%C3%AAn_-_Artist_Lunae_Lumen_-_Four_Palaces_T%E1%BB%A9_Ph%E1%BB%A7.jpg,Mẫu Thượng Thiên,,Mẫu Thượng Thiên,"Tranh vẽ Mẫu Thượng Thiên trong trang phục nhà Lê, bởi hoạ sĩ Lunae Lumen.","English: {""subsource"":""done_button"",""uid"":""4AD794FA-A442-4071-9E2E-01B852822225_1592416980045"",""source"":""other"",""origin"":""gallery"",""source_sid"":""4AD794FA-A442-4071-9E2E-01B852822225_1592416980209""}",,image/jpeg,3810,2500,True,True,True,"Mẫu Thượng Thiên là một vị Mẫu thần thuộc nhánh Tứ Phủ của Đạo Mẫu Việt Nam. Mẫu là người cai quản Thiên Phủ.
Các nhân vật sau đây được coi là hóa thân của Mẫu Thượng Thiên hay Mẫu Đệ Nhất:
Cửu Trùng Thiên Thanh Vân Công Chúa
Tây Thiên Quốc Mẫu Lăng Thị Tiêu
Liễu Hạnh Công Chúa
Nữ Thần Thiên Y A Na
Mẫu Thượng Thiên đôi khi chỉ được gọi bằng cái tên chung chung như Mẫu Đệ Nhất. Mẫu hay được khắc hoạ với tông màu đỏ, màu của Thiên Phủ. Tượng Mẫu Đệ Nhất thông thường được đặt chính giữa, hai bên là tượng Mẫu Thượng Ngàn và Mẫu Thoải."
181,ceb,https://ceb.wikipedia.org/wiki/Dendrobium_guerreroi,https://upload.wikimedia.org/wikipedia/commons/e/ee/Dendrobium_guerreroi.jpg,Dendrobium guerreroi,,Dendrobium guerreroi,,"Français&#160;: Orchidée endémique des Philippines, dont le nom rend hommage à M. Guerrero, un collectionneur du début du 19° siècle",,image/jpeg,3872,2592,True,True,True,Espesye sa orkidya ang Dendrobium guerreroi. Una ning gihulagway ni Oakes Ames ug Eduardo Quisumbing y Argüelles. Ang Dendrobium guerreroi sakop sa kahenera nga Dendrobium sa kabanay nga Orchidaceae. Pagka karon wala pay siak nga nalista ubos niini niya.
182,vi,https://vi.wikipedia.org/wiki/Sarawak,https://upload.wikimedia.org/wikipedia/commons/5/58/Hong_San_Si_Temple_11.jpg,Sarawak,Ngày lễ và lễ hội,Sarawak / Văn hóa / Ngày lễ và lễ hội,Người Sarawak tổ chức lễ hội có trình diễn pháo hoa.,"English: View of the parade of the Hong San Si Temple held annually on the 22nd day of the second month of the Chinese lunar calendar. This is a photo of a monument in Malaysia, identified by ID 13-SWK/35",,image/jpeg,3264,2448,True,True,True,"Sarawak là một trong hai bang của Malaysia nằm trên đảo Borneo. Lãnh thổ này có quyền tự trị nhất định trên lĩnh vực hành chính, nhập cư và tư pháp khác biệt với các bang tại bán đảo Mã Lai. Sarawak nằm tại miền tây bắc đảo Borneo, giáp với bang Sabah về phía đông bắc, giáp với phần đảo Borneo thuộc Indonesia hay còn gọi là Kalimantan về phía nam, và giáp với quốc gia độc lập Brunei tại đông bắc. Thành phố thủ phủ bang là Kuching, đây là trung tâm kinh tế của bang và là nơi đặt trụ sở chính phủ cấp bang. Các thành thị lớn khác tại Sarawak gồm Miri, Sibu, và Bintulu. Theo điều tra nhân khẩu năm 2015 tại Malaysia, tổng dân số Sarawak là 2.636.000. Sarawak có khí hậu xích đạo cùng các khu rừng mưa nhiệt đới và các loài động thực vật phong phú. Sarawak sở hữu một số hệ thống hang động đáng chú ý tại Vườn quốc gia Gunung Mulu. Sông Rajang là sông dài nhất tại Malaysia; Đập Bakun trên một phụ lưu của sông này nằm trong số các đập lớn nhất của Đông Nam Á. Núi Murud là điểm cao nhất tại Sarawak.
Khu định cư sớm nhất được biết đến tại Sarawak có niên đại từ 40.000 năm trước tại Hang Niah."
183,vi,https://vi.wikipedia.org/wiki/Crinum_thaianum,https://upload.wikimedia.org/wikipedia/commons/7/75/Crinum_thaianum_in_Thailand.jpg,Crinum thaianum,,Crinum thaianum,,English: Crinum thaianum in Thailand (3 Dec. 2003). Credit: R. Pooma.,,image/jpeg,682,1024,True,True,True,Crinum thaianum là một loài thực vật có hoa trong họ Amaryllidaceae. Loài này được J.Schulze mô tả khoa học đầu tiên năm 1971.
184,vi,https://vi.wikipedia.org/wiki/USS_Philip_(DD-498),https://upload.wikimedia.org/wikipedia/commons/d/dc/USS_Philip_%28DD-498%29_underway_in_the_Pacific_Ocean_on_9_July_1968_%28NH_98592%29.jpg,USS Philip (DD-498),,USS Philip (DD-498),"Tàu khu trục USS Philip (DD-498) trên đường đi tại Thái Bình Dương, 9 tháng 7 năm 1968",English: The U.S. Navy destroyer USS Philip (DD-498) underway in the Pacific Ocean on 9 July 1968. This was very near the end of her service. She was decommissioned on 30 September 1968 and stricken on the following day.,"USS Philip (DD-498) underway in the Pacific Ocean, ngày 9 tháng 7 năm 1968.",image/jpeg,571,740,True,True,True,"USS Philip là một tàu khu trục lớp Fletcher được Hải quân Hoa Kỳ chế tạo trong Chiến tranh Thế giới thứ hai. Nó là chiếc tàu chiến thứ hai của Hải quân Mỹ được đặt theo tên Chuẩn đô đốc John W. Philip, người tham gia cuộc Nội chiến Hoa Kỳ và cuộc Chiến tranh Tây Ban Nha-Hoa Kỳ. Nó hoạt động cho đến hết Thế Chiến II, còn tiếp tục tham gia Chiến tranh Triều Tiên và Chiến tranh Việt Nam, cho đến khi ngừng hoạt động năm 1968 và bị bán để tháo dỡ năm 1971. Nó được tặng thưởng chín Ngôi sao Chiến trận trong Thế Chiến II và thêm năm Ngôi sao Chiến trận khác tại Triều Tiên."
185,id,https://id.wikipedia.org/wiki/Seladang,https://upload.wikimedia.org/wikipedia/commons/c/cc/Indian_Bison_%28Gaur%29_1_by_N._A._Naseer.jpg,Seladang,,Seladang,,മലയാളം: കാട്ടുപോത്ത്.English: Gaur or Indian Bison (Bos gaurus).,,image/jpeg,1075,1588,True,True,True,"Seladang atau di India dikenal dengan nama Gaur, yang juga disebut bison India, adalah hewan sepeti sapi yang hidup di Asia Selatan dan Asia Tenggara. Spesies ini masuk ke dalam daftar hewan yang dilindungi. Beberapa dekade terakhir, gaur mengalami penurunan populasi lebih dari 70%. Gaur lebih besar dari kerbau Afrika dan kerbau liar.
Gaur adalah spesies lembu liar tertinggi.
Gaur Malaya disebut seladang, dan gaur Burma disebut pyoung ပြောင်."
186,war,https://war.wikipedia.org/wiki/Homaloptera_zollingeri,https://upload.wikimedia.org/wikipedia/commons/9/9f/Homaloptera_zollingeri_Bleeker.jpg,Homaloptera zollingeri,,Homaloptera zollingeri,,English: Homaloptera zollingeri,,image/jpeg,942,1272,True,True,True,"An Homaloptera zollingeri in uska species han Actinopterygii nga ginhulagway ni Pieter Bleeker hadton 1853. An Homaloptera zollingeri in nahilalakip ha genus nga Homaloptera, ngan familia nga Balitoridae. Ginklasipika han IUCN an species komo diri gud kababarak-an. Waray hini subspecies nga nakalista."
187,vi,https://vi.wikipedia.org/wiki/USS_Yorktown_(CV-10),http://upload.wikimedia.org/wikipedia/commons/f/f1/USS_Yorktown_from_Charleston_Harbor.JPG,USS Yorktown (CV-10),Tàu bảo tàng,USS Yorktown (CV-10) / Tàu bảo tàng,"USS Yorktown neo đậu tại Cảng Charleston, tháng 11 năm 2007",A picture of the USS Yorktown CV-10 taken on a ferry touring Charleston Harbor,,image/jpeg,1870,2469,True,True,True,"USS Yorktown là một trong số 24 chiếc tàu sân bay thuộc lớp Essex được chế tạo cho Hải quân Hoa Kỳ trong Thế Chiến II. Nó được đặt tên theo trận Yorktown xảy ra năm 1781 trong Chiến tranh giành độc lập Hoa Kỳ, và là chiếc tàu chiến thứ tư của Hải quân Mỹ mang cái tên này. Ban đầu được đặt tên là Bon Homme Richard, nó được đổi tên thành Yorktown trong khi đang được chế tạo để tưởng niệm chiếc USS Yorktown, bị mất trong trận Midway vào tháng 6 năm 1942. Yorktown được đưa vào hoạt động vào tháng 4 năm 1943, tham gia vào nhiều chiến dịch tại Mặt trận Thái Bình Dương, được tặng thưởng danh hiệu Đơn vị Tuyên dương Tổng thống và 11 ngôi sao chiến đấu.
Được rút khỏi hoạt động không lâu sau khi chiến tranh kết thúc, nó được hiện đại hóa và được vào hoạt động trở lại vào đầu những năm 1950 như một tàu sân bay tấn công, và sau đó như là một tàu sân bay chống tàu ngầm. Nó được đưa ra hoạt động trở lại quá trễ để có thể tham gia Chiến tranh Triều Tiên, nhưng nó đã phục vụ nhiều năm tại Thái Bình Dương, kể cả các hoạt động trong Chiến tranh Việt Nam, trong đó nó được tặng thưởng thêm năm ngôi sao chiến đấu nữa. Sau đó nó còn được sử dụng để quay các cảnh trong bộ phim Tora! Tora! Tora!"
188,id,https://id.wikipedia.org/wiki/Maraden_Panggabean,https://upload.wikimedia.org/wikipedia/commons/8/8c/Jenderal_TNI_Maraden_Panggabean.png,Maraden Panggabean,Karier militer,Maraden Panggabean / Karier militer,Jenderal TNI Maraden Panggabean.,Bahasa Indonesia: Jenderal TNI Maraden Panggabean sebagai Panglima Angkatan Bersenjata Republik IndonesiaEnglish: General Maraden Panggabean as Commander of the Indonesian National Armed Forces,,image/png,314,233,True,True,True,"Jenderal TNI Maraden Saur Halomoan Panggabean adalah salah seorang tokoh militer Indonesia yang pernah menjadi Menteri Pertahanan dan Keamanan dalam Kabinet Pembangunan II serta Menteri Koordinator Politik dan Keamanan dalam Kabinet Pembangunan III. Selanjutnya pada tahun 1983—1988, Maraden menjabat Ketua Dewan Pertimbangan Agung."
189,vi,https://vi.wikipedia.org/wiki/HMS_Prince_of_Wales_(53),https://upload.wikimedia.org/wikipedia/commons/a/af/Prince_of_Wales-4.jpg,HMS Prince of Wales (53),Bị đánh chìm tại Biển Đông,HMS Prince of Wales (53) / Lịch sử hoạt động / Bị đánh chìm tại Biển Đông,"Nghi lễ tôn giáo trên sàn phía sau của HMS Prince of Wales, trong giai đoạn diễn ra hội nghị Newfoundland.",,,image/jpeg,506,740,True,True,True,"HMS Prince of Wales (53) là một thiết giáp hạm thuộc lớp King George V của Hải quân Hoàng gia Anh Quốc từng hoạt động vào giai đoạn mở màn của Chiến tranh Thế giới thứ hai. Prince of Wales chỉ có một quãng đời phục vụ ngắn ngủi nhưng tích cực, đã đối đầu với thiết giáp hạm Đức Bismarck, và đưa Thủ tướng Churchill tham dự Hội nghị Newfoundland trước khi được bố trí sang Viễn Đông; tuy nhiên, việc nó cùng với tàu chiến-tuần dương Repulse bị đánh chìm bởi máy bay ném bom Nhật Bản đặt căn cứ từ đất liền trong Biển Đông vào ngày 10 tháng 12 năm 1941 là một sự kiện quan trọng đánh dấu chấm hết cho vai trò của thiết giáp hạm như một lớp tàu thống trị trong hải chiến."
190,vi,https://vi.wikipedia.org/wiki/Douglas_SBD_Dauntless,https://upload.wikimedia.org/wikipedia/commons/a/a6/Douglas_SBD_5_tricolor_with_bomb.jpg,Douglas SBD Dauntless,Thiết kế và phát triển,Douglas SBD Dauntless / Thiết kế và phát triển,SBD-5,"A U.S. Navy or Marine Corps Douglas SBD-5 Dauntless in tricolor scheme carrying bomb, ca. 1944-45.",,image/jpeg,196,432,True,True,True,"Douglas SBD Dauntless là kiểu máy bay ném bom bổ nhào chủ yếu của Hải quân Hoa Kỳ trong nửa đầu của Thế Chiến II. Chiến công đáng chú ý nhất của nó là đánh chìm 4 tàu sân bay chủ yếu của Hải quân Nhật trong Trận chiến Midway, và nó là chiếc máy bay đánh chìm được nhiều tàu nhất tại Thái Bình Dương so với mọi kiểu máy bay khác của Đồng Minh. Cho đến hết cuộc chiến, nó được dần thay thế bởi chiếc SB2C Helldiver trong vai trò ném bom bổ nhào trên tàu sân bay.
So với những máy bay ném bom bổ nhào cùng thời như Junkers Ju 87 hay Aichi D3A, chiếc Dauntless có khả năng mang nhiều bom hơn, dù ngang bằng về tốc độ. Điểm mạnh của thiết kế Dauntless so với hai thiết kế trên là bộ càng đáp xếp được, giúp giảm lực cản khí động và đồng nghĩa với việc chiếc Dauntless có thể cơ động hơn. Lục quân Hoa Kỳ cũng có phiên bản riêng của chiếc SBD, tên là A-24 Banshee, nguyên là cùng một kiểu máy bay với vài thay đổi. Hai phiên bản A-24A và A-24B được sản xuất và được Lục quân sử dụng trong và sau chiến tranh."
